Rank,Title,Citations,Year,URL,Description
46,Exploring AI intervention points in high-school engineering education: a research through co-design approach,2,2025,https://scholar.google.com/citations?view_op=view_citation&hl=en&user=ZRTiCX4AAAAJ&pagesize=50&citation_for_view=ZRTiCX4AAAAJ:4vMrXwiscB8C,"Purpose Challenges in teaching the engineering design process (EDP) at the high-school level, such as promoting good documentation practices, are well-documented. While developments in educational artificial intelligence (AI) systems have the potential to assist in addressing these challenges, the open-ended nature of the EDP leads to challenges that often lack the specificity required for actionable AI development. In addition, conventional educational AI systems (e.g. intelligent tutoring systems) primarily target procedural domain tasks with well-defined outcomes and problem-solving strategies, while the EDP involves open-ended problems and multiple correct solutions, making AI intervention timing and appropriateness complex. Design/methodology/approach Authors conducted a six-week-long Research through Co-Design (RtCD) process (i.e. a co-design process rooted …"
47,Skills and dispositions for pfl: Promoting data literacy for middle school students in a summer camp,2,2025,https://scholar.google.com/citations?view_op=view_citation&hl=en&user=ZRTiCX4AAAAJ&pagesize=50&citation_for_view=ZRTiCX4AAAAJ:DJbcl8HfkQkC,"We designed a two-week summer camp to support Preparation for Future Learning (PFL) in data literacy by fostering both skills and dispositions. Middle schoolers create data visualization stories to address community-related issues they identified. Analysis showed growth in data visualization skills, self-efficacy, and recognition of data visualization’s value. We observed frequent student decision-making, suggesting agency as a key factor. This work prompts future studies on activating agency support PFL for data literacy."
48,Problem-solving or Solved Problems: Constricting design challenges in high-school engineering education to avoid (disruptive) failures,2,2023,https://scholar.google.com/citations?view_op=view_citation&hl=en&user=ZRTiCX4AAAAJ&pagesize=50&citation_for_view=ZRTiCX4AAAAJ:Ri6SYOTghG4C,"We investigate how high-school engineering teachers anticipate and deal with disruptive and productive failures in students’ design challenges. This study involved a six-week participatory design process with two teachers, revealing that teachers often make design challenges too prescriptive in order to prevent disruptive failures, which can hinder opportunities for productive failures. We discuss the implications of failure mitigation and suggest opportunities to better support teachers, including the design of an intelligent system."
49,Examining hard and soft skill prioritization in high school engineering education,2,2023,https://scholar.google.com/citations?view_op=view_citation&hl=en&user=ZRTiCX4AAAAJ&pagesize=50&citation_for_view=ZRTiCX4AAAAJ:YohjEiUPhakC,"In high school engineering education teachers face a significant pedagogical load, trying to integrate different dimensions of ‘hard’and ‘soft’skills alongside codified educational standards in their teaching. Artificial intelligence systems may have promise to relieve some load for teachers, but care must be taken to design these systems to support, not hinder, teachers’ own pedagogical priorities. Towards designing an AI system for engineering education classrooms, we conducted a semi-structured interview study (N= 5) with high school engineering teachers to elicit their pedagogical practices around the engineering design process (EDP). Here we investigate how teachers prioritize ‘hard’and ‘soft’skills for their students in engineering design projects and explore the implications of supporting these skills via an intelligent system."
50,Chameleon Clippers: A Tool for Developing Fine Motor Skills in Remote Education Settings,2,2022,https://scholar.google.com/citations?view_op=view_citation&hl=en&user=ZRTiCX4AAAAJ&pagesize=50&citation_for_view=ZRTiCX4AAAAJ:edDO8Oi4QzsC,"Art education plays a significant role in K-2 learners’ physical and cognitive development. However, teachers struggle to translate in-person activities to remote settings and to give necessary feedback to help learners develop fine motor skills. Previous research shows the benefits of tangible technology and real-time system feedback for supporting teachers and students in digital environments, but little research explores their affordances for remote art education. We developed Chameleon Clippers: interactive scissors that give real-time feedback to learners as they cut along a line. In preliminary tests, learners felt engaged and responded to feedback, enjoying their experience. Our low-cost design augments existing classroom artefacts and practices, supporting classroom integration. Testing also revealed directions for future study, including the frequency of feedback and assimilation into a broader, art education platform. Through our study, we demonstrate the potential for tangible technology to create more interactive, engaging, and supportive remote K-2 learning experiences."
