Rank,Title,Citations,Year,URL,Description
1,"Myths, mis-and preconceptions of artificial intelligence: A review of the literature",209,2023,https://scholar.google.com/citations?view_op=view_citation&hl=en&user=ZRTiCX4AAAAJ&pagesize=50&citation_for_view=ZRTiCX4AAAAJ:a9-T7VOCCH8C,"Artificial Intelligence (AI) is prevalent in nearly every aspect of our lives. However, recent studies have found a significant amount of confusion and misunderstanding surrounding AI. To develop effective educational programs in the field of AI, it is vital to examine and understand learners' pre- and misconceptions as well as myths about AI. This study examined a corpus of 591 studies. 25 relevant studies were identified by applying the following eligibility criteria: English-written original empirical research on education and AI and reporting AI conceptions in a formal learning context. The review found studies from six continents, with the majority conducted in Europe and North America. The studies predominantly focus on the school and university levels. Findings reveal a range of preconceptions, misconceptions, and myths about AI, such as: Learners often have limited understanding of AI on a technical level. They …"
2,Mortality risk from United States coal electricity generation,113,2023,https://scholar.google.com/citations?view_op=view_citation&hl=en&user=ZRTiCX4AAAAJ&pagesize=50&citation_for_view=ZRTiCX4AAAAJ:4fGpz3EwCPoC,"Policy-makers seeking to limit the impact of coal electricity-generating units (EGUs, also known as power plants) on air quality and climate justify regulations by quantifying the health burden attributable to exposure from these sources. We defined “coal PM2.5” as fine particulate matter associated with coal EGU sulfur dioxide emissions and estimated annual exposure to coal PM2.5 from 480 EGUs in the US. We estimated the number of deaths attributable to coal PM2.5 from 1999 to 2020 using individual-level Medicare death records representing 650 million person-years. Exposure to coal PM2.5 was associated with 2.1 times greater mortality risk than exposure to PM2.5 from all sources. A total of 460,000 deaths were attributable to coal PM2.5, representing 25% of all PM2.5-related Medicare deaths before 2009 and 7% after 2012. Here, we quantify and visualize the contribution of individual EGUs to mortality."
3,Interpreting data from within: supporting humandata interaction in museum exhibits through perspective taking,73,2014,https://scholar.google.com/citations?view_op=view_citation&hl=en&user=ZRTiCX4AAAAJ&pagesize=50&citation_for_view=ZRTiCX4AAAAJ:u5HHmVD_uO8C,"As data rather than physical artifacts become more commonly the product of modern scientific endeavor, we must attend to humandata interactions as people reason about and with representations of data increasingly being presented in museum settings. Complex data sets can be impenetrable for novices, so the exhibit presented here was designed to give visitors control over a personalized ""slice"" of the data set as an entry point for exploration. Personalized control and collaboration can often be at odds in exhibits, however. This paper presents a study of two alternate approaches to designing an embodied interaction control for the exhibit that serves both needs. The results demonstrate that interaction design can affect children's perspective taking as they interact with a Census data map museum display, and that the perspective taken by individuals is correlated with their operation of the interactive exhibit and …"
4,Digital exhibit labels in museums: promoting visitor engagement with cultural artifacts,68,2018,https://scholar.google.com/citations?view_op=view_citation&hl=en&user=ZRTiCX4AAAAJ&pagesize=50&citation_for_view=ZRTiCX4AAAAJ:8AbLer7MMksC,"How can we use interactive displays in museums to help visitors appreciate authentic objects and artifacts that they can't otherwise touch or manipulate? This paper shares results from a design-based research study on the use of interactive displays to help visitors learn about artifacts in an exhibit on the history and culture of China. To explore the potential afforded by these displays, we unobtrusively video recorded 834 museum visitor groups who stopped in front of one collection of objects. Drawing on cognitive models of curiosity, we tested three redesigns of this display, each focusing on a different strategy to spark visitor curiosity, interest, and engagement. To understand the relative effectiveness of these designs, we analyzed visitor interaction and conversation. Our results uncovered significant differences across the conditions suggesting implications for the use of such technology in museums."
5,Examining spontaneous perspective taking and fluid self-to-data relationships in informal open-ended data exploration,62,2022,https://scholar.google.com/citations?view_op=view_citation&hl=en&user=ZRTiCX4AAAAJ&pagesize=50&citation_for_view=ZRTiCX4AAAAJ:uLbwQdceFCQC,"Engaging learners with complex unfamiliar datasets is a known challenge in Data Science education. One promising phenomenon investigated in related work is perspective-taking. A first-person “actor” perspective can help facilitate group and individual sensemaking by mediating observations and actions taken by learners. Here we investigate how museum visitors made use of an actor perspective when exploring an open-ended, interactive data map museum exhibit. We use a mix of qualitative and quantitative empirical methods to explore how actor perspective-taking (APT) may mediate joint sensemaking around data visualizations. By applying interpretive coding to 54 conversations wherein APT naturalistically emerged, we identify 3 distinct self-to-data relationships constructed via APT: role-play, projection, and orientation. A further analysis explores how APT was embedded in joint sensemaking of the …"
6,I see you there! Developing identity-preserving embodied interaction for museum exhibits,58,2013,https://scholar.google.com/citations?view_op=view_citation&hl=en&user=ZRTiCX4AAAAJ&pagesize=50&citation_for_view=ZRTiCX4AAAAJ:u-x6o8ySG0sC,"Museums are increasingly embracing technologies that provide highly-individualized and highly-interactive experiences to visitors. With embodied interaction experiences, increased localization accuracy supports greater nuance in interaction design, but there is usually a tradeoff between fast, accurate tracking and the ability to preserve the identity of users. Customization of experience relies on the ability to detect the identity of visitors, however. We present a method that combines fine-grained indoor tracking with robust preservation of the unique identities of multiple users. Our model merges input from an RFID reader with input from a commercial camera-based tracking system. We developed a probabilistic Bayesian model to infer at run-time the correct identification of the subjects in the camera's field of view. This method, tested in a lab and at a local museum, requires minimal modification to the exhibition …"
7,"The value of learning talk: applying a novel dialogue scoring method to inform interaction design in an open-ended, embodied museum exhibit",55,2017,https://scholar.google.com/citations?view_op=view_citation&hl=en&user=ZRTiCX4AAAAJ&pagesize=50&citation_for_view=ZRTiCX4AAAAJ:B3FOqHPlNUQC,"Museum researchers have long acknowledged the importance of dialogue in informal learning, particularly for open-ended exploratory exhibits. Novel interaction techniques like full-body interaction are appealing for these exploratory exhibits, but designers have not had a metric for determining how their designs are supporting productive learning talk. Moreover, with the incorporation of digital technologies into museums, researchers and designers now have the opportunity for in situ A/B testing of multiple exhibit designs not previously possible with traditionally constructed exhibits, which once installed were difficult and expensive to iterate. Here we present a method called Scoring Qualitative Informal Learning Dialogue (SQuILD) for quantifying idiosyncratic social learning talk, in order to conduct in situ testing of group learning at interactive exhibits. We demonstrate how the method was applied to a 2 × 2 …"
8,"Testing, socializing, exploring: Characterizing middle schoolers’ approaches to and conceptions of ChatGPT",43,2024,https://scholar.google.com/citations?view_op=view_citation&hl=en&user=ZRTiCX4AAAAJ&pagesize=50&citation_for_view=ZRTiCX4AAAAJ:HtEfBTGE9r8C,"As generative AI rapidly enters everyday life, educational interventions for teaching about AI need to cater to how young people, in particular middle schoolers who are at a critical age for reasoning skills and identity formation, conceptualize and interact with AI. We conducted nine focus groups with 24 middle school students to elicit their interests, conceptions of, and approaches to a popular generative AI tool, ChatGPT. We highlight a) personally and culturally-relevant topics to this population, b) three distinct approaches in students’ open-ended interactions with ChatGPT: AI testing-oriented, AI socializing-oriented, and content exploring-oriented, and 3) an improved understanding of youths’ conceptions and misconceptions of generative AI. While misconceptions highlight gaps in understanding what generative AI is and how it works, most learners show interest in learning about what AI is and what it can do. We …"
9,"AI literacy: Finding common threads between education, design, policy, and explainability",38,2023,https://scholar.google.com/citations?view_op=view_citation&hl=en&user=ZRTiCX4AAAAJ&pagesize=50&citation_for_view=ZRTiCX4AAAAJ:FPJr55Dyh1AC,"Fostering public AI literacy has been a growing area of interest at CHI for several years, and a substantial community is forming around issues such as teaching children how to build and program AI systems, designing learning experiences to broaden public understanding of AI, developing explainable AI systems, understanding how novices make sense of AI, and exploring the relationship between public policy, ethics, and AI literacy. Previous workshops related to AI literacy have been held at other conferences (e.g., SIGCSE, AAAI) that have been mostly focused on bringing together researchers and educators interested in AI education in K-12 classroom environments, an important subfield of this area. Our workshop seeks to cast a wider net that encompasses both HCI research related to introducing AI in K-12 education and also HCI research that is concerned with issues of AI literacy more broadly, including …"
10,Framed guessability: using embodied allegories to increase user agreement on gesture sets,34,2014,https://scholar.google.com/citations?view_op=view_citation&hl=en&user=ZRTiCX4AAAAJ&pagesize=50&citation_for_view=ZRTiCX4AAAAJ:d1gkVwhDpl0C,"Despite the wide availability of body-sensing technologies, the design of control gestures that feel natural and that can be intuitively ""guessed"" by the users is still an embodied interaction challenge. This is especially true for systems that require a set of complementary control gestures. Part of the problem lies in the separation between the locus of the interaction (the body) and the focus of the interaction (the screen). We extend Johnson's theory of Embodied Schemata with Embodied Allegories, in order to create a unifying context that spans across the locus and focus of interaction. We present results that demonstrate how this approach increases the chance that users select the same gesture or movement for producing an effect within the virtual context, and that the resultant gesture set is deemed more intuitive by users. We also present the accompanying methodology, ""Framed Guessability,"" which can increase …"
11,Fostering AI literacy with embodiment & creativity: From activity boxes to museum exhibits,32,2023,https://scholar.google.com/citations?view_op=view_citation&hl=en&user=ZRTiCX4AAAAJ&pagesize=50&citation_for_view=ZRTiCX4AAAAJ:hCrLmN-GePgC,"Fostering young learners’ literacy surrounding AI technologies is becoming increasingly important as AI is becoming integrated in many aspects of our lives and is having far-reaching impacts on society. We have developed Knowledge Net and Creature Features, two activity boxes for family groups to engage with in their homes that communicate AI literacy competencies such as understanding knowledge representations, the steps of machine learning, and AI ethics. Our current work is exploring how to transform these activity boxes into museum exhibits for middle-school age learners, focusing on three key considerations: centering learner interests, generating personally meaningful outputs, and incorporating embodiment and collaboration on a larger scale. Our demonstration will feature the existing Knowledge Net and Creature Features activity boxes alongside early-stage prototypes adapting these activities …"
12,Scoring qualitative informal learning dialogue: The squild method for measuring museum learning talk,24,2017,https://scholar.google.com/citations?view_op=view_citation&hl=en&user=ZRTiCX4AAAAJ&pagesize=50&citation_for_view=ZRTiCX4AAAAJ:4fKUyHm3Qg0C,"Museums are increasingly developing computer-supported collaborative learning experiences and are in need of methods for evaluating the educational value of such exhibits. Exhibit designers, like web interaction designers, have long been employing A/B testing of exhibit elements in order to understand the affordances of competing designs in situ. When the exhibit elements being tested are intended to support open-ended group exploration and dialogue, existing knowledge-based metrics like measuring the amount of content recalled don’t quite apply. Visitor groups can explore the educational content in idiosyncratic ways, meaning that not all groups have the same exposure to content, and the learning arises from the visitors’ conversations. In order to evaluate learning outcomes for CSCL exhibits, we present a method for quantifying idiosyncratic social learning, Scoring Qualitative Informal Learning Dialogue (SQuILD), and demonstrate how it was applied to A/B testing of a collaborative data visualization exhibit in a metropolitan museum."
13,"Results of a 2-Stage, Phase 3 Pivotal Trial, EDEMA3®: A Study of Subcutaneous DX-88 (Ecallantide), a Plasma Kallikrein Inhibitor, in Patients with Hereditary Angioedema (HAE)",20,2008,https://scholar.google.com/citations?view_op=view_citation&hl=en&user=ZRTiCX4AAAAJ&pagesize=50&citation_for_view=ZRTiCX4AAAAJ:_FM0Bhl9EiAC,"MethodsIn the double-blind stage, 72 patients were randomized 1: 1 to receive ecallantide or placebo. In the open-label stage, 67 patients were treated for 160 attacks. Efficacy was assessed using HAE-specific measures of patient-reported outcome (PRO): Treatment Outcome Score (TOS; range-100 to 100) and Mean Symptom Complex Severity Score (MSCS; range 0 to 3).ResultsThe primary endpoint, mean TOS at 4 hours, showed statistically significant improvement in ecallantide patients compared with placebo (53.8 vs 18.5, p= 0.02), with sustained improvement at 24 hours (48.8 vs-0.5, p= 0.03). Change from baseline in MSCS was significant at 4 hours (-0.96 ecallantide,-0.48 placebo, p= 0.02), with similar severity scores at 24 hours (-0.93 vs.-0.46, p= 0.10). Mean time to significant overall improvement was 124.5 minutes ecallantide vs 196 minutes placebo (p= 0.04). Medical intervention was required in 14 …"
14,"Reflective spectroscopy investigations of clothing items to support law enforcement, search and rescue, and war crime investigations",18,2019,https://scholar.google.com/citations?view_op=view_citation&hl=en&user=ZRTiCX4AAAAJ&pagesize=50&citation_for_view=ZRTiCX4AAAAJ:IRz6iEL74y4C,"Clothing articles are important pieces of evidence in criminal, search and rescue, and search and recovery investigations. Hyperspectral remote sensing of clothing will be an important tool for supporting such investigations in the near future. This study investigated over 300 items of clothing that varied in fabric type, texture, color, and pattern. Clothing items were analyzed using an ASD FieldSpec 4 High Resolution spectroradiometer with a contact probe attachment. Of the clothing items analyzed, there were 141 having endmember fabrics (100% single fabric type composition): 89 were cotton, 39 were polyester, 5 were wool, 1 was cashmere, 3 were acrylic, 1 was leather, and 3 were rayon. The remaining 164 clothing items were various fabric blends. Spectral features relating to different fabric types exhibit sufficient differences that allow them to be discriminated from the surrounding environment, as well as from …"
15,The uncanny valley of embodied interaction design,18,2014,https://scholar.google.com/citations?view_op=view_citation&hl=en&user=ZRTiCX4AAAAJ&pagesize=50&citation_for_view=ZRTiCX4AAAAJ:5Ul4iDaHHb8C,"The ""Uncanny Valley"" theory explains the counter-intuitive phenomenon where people may get suddenly uncomfortable with an artificial entity when it becomes very similar to humans. We propose the existence of an ""uncanny valley"" for embodied interaction, when a user's body motions in the physical space (the locus of interaction) are incompletely mapped into effects in the virtual space (the focus of interaction). It is generally assumed that this mapping should be as veridical as possible to promote seamless embodied interaction. Many design factors (e.g., synchronicity, sensitivity, shared realism) contribute to veridical locus-focus mapping. We intentionally varied the level of veridicality of these different factors, affecting how the user's movements were mapped to virtual effects. Our results indicate that there is a dip (valley) in user preferences when the design contains mixed degrees of veridicality. Thus, when …"
16,RFID localization for tangible and embodied multi-user interaction with museum exhibits,16,2010,https://scholar.google.com/citations?view_op=view_citation&hl=en&user=ZRTiCX4AAAAJ&pagesize=50&citation_for_view=ZRTiCX4AAAAJ:eJXPG6dFmWUC,"RFID is usually used for identification but with some post-processing it can also be used for localization. These properties expand the typical range of possible interactions with digital displays in museums. Our goal is to encourage the collaborative investigation of a rich information space presented on an Ambient Display in a museum exhibit. We consider two different models of interacting with an exhibit: Tangible Control, wherein passive RFID tags are embedded in some artifacts and multiple users can control the information on the screen by moving those artifacts, and Embodied Control, wherein people directly carry an RFID tag and interact with the information by walking within the simulation space. Each model has different implications for how the visitors might relate (a) to the information being displayed, and (b) to one another. Here we present preliminary results on the suitability of a single-reader and …"
17,Data through movement: Designing embodied human-data interaction for informal learning,14,2026,https://scholar.google.com/citations?view_op=view_citation&hl=en&user=ZRTiCX4AAAAJ&pagesize=50&citation_for_view=ZRTiCX4AAAAJ:lmc2jWPfTJgC,"This revised edition revisits the dynamic and developing field of human-data interactions (HDI). It draws on frameworks from the learning sciences, cognitive linguistics, visualization, and human-computer interaction to explore embodied HDI. This exciting sub-field of interaction design is based on the premise that every day we produce and have access to quintillions of bytes of data, the exploration and analysis of which are no longer confined within the walls of research laboratories. This new edition examines how people interact with data in informal environments like museums, where engagement is often brief and self-directed. The first half of the book provides an overview of the multi-disciplinary, theoretical foundations of HDI, including embodied cognition, conceptual metaphor theory, embodied interaction, and embodied learning. It also reviews socio-technical theories essential for designing HDI installations that support informal, social learning in spaces like museums. The second half of the book describes strategies for engaging museum visitors with interactive data visualizations, It presents detailed methodologies for designing intuitive hand gestures and body movements for embodied installations. Through case studies of prototype exhibits, it illustrates how thoughtfully designed embodied HDI can facilitate deeper public sensemaking about complex topics such as census data, perspective-taking, correlation, and causation. This cross-disciplinary book is intended as a resource for students and early-career researchers in human-computer interaction, the learning sciences, and data visualization, as well as for more senior researchers …"
18,Analyzing the affordances of mobile technologies for informal science learning,14,2010,https://scholar.google.com/citations?view_op=view_citation&hl=en&user=ZRTiCX4AAAAJ&pagesize=50&citation_for_view=ZRTiCX4AAAAJ:9yKSN-GCB0IC,"Parent-child interactions, and particularly parent-child conversations, in Informal Science Institutions (ISIs) have a critical role in helping to shape children's ways of thinking about science and about the world. The incorporation of mobile technology into ISIs opens up new possibilities for supporting informal learning processes, but little attention has been given to how the addition of such technology might affect the parent-child dynamic, as mobile applications are most typically designed with only a single user in mind. Existing research on the practices that parents engage in to support their children's learning in ISIs reveals that while some practices may result in parents' desired learning outcomes, others are less effective or even detrimental. This article discusses ways that mobile technology may be productively integrated into the learning context, either by aligning with successful practices or by strategically …"
19,Data literacy for social justice,13,2020,https://scholar.google.com/citations?view_op=view_citation&hl=en&user=ZRTiCX4AAAAJ&pagesize=50&citation_for_view=ZRTiCX4AAAAJ:z_wVstp3MssC,"The projects in this interactive poster symposium explore ways of engaging learners with social justice issues through the design and study of data literacy interventions. These interventions span classroom to museum contexts, and environmental to social sciences domains. Together, they illustrate research and practice approaches for engaging learners with data to promote emancipatory activity."
20,"American Journalism and"" Fake News""",11,2018,https://scholar.google.com/citations?view_op=view_citation&hl=en&user=ZRTiCX4AAAAJ&pagesize=50&citation_for_view=ZRTiCX4AAAAJ:KUbvn5osdkgC,"Title: American journalism and “fake news”: examining the facts/Seth Ashley, Jessica Roberts, and Adam Maksl. Description: Santa Barbara, Caifornia: ABC-CLIO, 2018.| Series: Contemporary debates| Includes bibliographical references and index. Identifiers: LCCN 2018035231 (print)| LCCN 2018047013 (ebook)| ISBN 9781440861840 (ebook)| ISBN 9781440861833 (alk. paper)"
21,Observations of the lifecycles and information worlds of collaborative scientific teams at a national science lab,11,2012,https://scholar.google.com/citations?view_op=view_citation&hl=en&user=ZRTiCX4AAAAJ&pagesize=50&citation_for_view=ZRTiCX4AAAAJ:-FonjvnnhkoC,"Team-based scientific collaborations play a key role in the discovery and distribution of scientific knowledge. In order to determine the social and organizational factors that help support a scientific team's successful transition from short-term experiments to long-term programs of ongoing scientific research, this study used observations of teams conducting experiments at the National High Magnetic Field Laboratory to determine what teams actually do during these experiments. As part of a larger, ongoing research project using mixed methods, our findings describe the scientific culture of hybrid teams at work, and demonstrate how multiple, overlapping, and nested lifecycles and information worlds play an important role in promoting successful and continuing scientific collaboration. The boundaries between worlds and efforts to span them are particularly important, requiring greater attention. Our future research will …"
22,“Let the Volcano Erupt!”: Designing Sonification to Make Oceanography Accessible for Blind and Low Vision Students in Museum Environment,10,2023,https://scholar.google.com/citations?view_op=view_citation&hl=en&user=ZRTiCX4AAAAJ&pagesize=50&citation_for_view=ZRTiCX4AAAAJ:bz8QjSJIRt4C,"Exploring the potential of data sonification, our study focuses on enhancing accessibility to oceanographic data for blind and low vision (BLV) students in museums. Five auditory display prototypes with accompanying data sonifications were designed, and two prototypes underwent evaluation by testing with blind and low vision students from two schools for the blind. Through interviews and qualitative analysis, the study assessed the students' learning outcomes and their experience on the auditory display prototypes. The results demonstrate the effective conveyance of oceanography concepts and data through the developed audio display prototypes. Additionally, the study derived several design implications for future oceanographic data sonification design in museums. This research contributes to advancing the accessibility of oceanography education for visually impaired students while providing valuable …"
