Rank,Title,Citations,Year,URL,Description
23,Uncovering patterns in constructionist collaborative learning activities via cluster analysis of museum exhibit log files,10,2020,https://scholar.google.com/citations?view_op=view_citation&hl=en&user=ZRTiCX4AAAAJ&pagesize=50&citation_for_view=ZRTiCX4AAAAJ:t7zJ5fGR-2UC,"A driving factor in designing interactive museum exhibits to support simultaneous users is that visitors learn from one another, via both observation and conversation. Such collaborative interactions among museum-goers are typically analyzed through manual coding of live-or video-recorded exhibit use. We sought to determine how log data from an interactive multi-user exhibit could indicate patterns in visitor interactions that could shed light on informal collaborative constructivist learning. We characterized patterns from log data generated by an interactive tangible tabletop exhibit using factors like"" pace of activity"" and the timing of “success events."" Here we describe processes for parsing and visualizing log data and explore what these processes revealed about individual and group interactions with interactive museum exhibits. Using clustering techniques to categorize museum-goer behavior and heat maps to visualize patterns in the log data, we found that there were distinct trends in how users approached solving the exhibit: some players seemed more reflective while others seemed more achievement oriented. We also found that the most productive sessions occurred when all four areas of the table were occupied, suggesting that the activity design had a desired outcome to promote collaborative activity."
24,That's me and that's you: Museum visitors' perspective-taking around an embodied interaction data map display,10,2013,https://scholar.google.com/citations?view_op=view_citation&hl=en&user=ZRTiCX4AAAAJ&pagesize=50&citation_for_view=ZRTiCX4AAAAJ:olpn-zPbct0C,"CoCensus, a museum exhibit leveraging embodied interaction, allows users to collaboratively explore US census data on a large GIS display. We utilize tracking technologies to support personalized interactions, and we examine users' perspective-taking when discussing and interpreting the data display. Here pronoun use is analyzed to examine how the affordances of this technology facilitate connections between visitors and the social worlds represented by the data."
25,Philosophical Linkages between Public Journalism and Citizen Journalism 1,9,2011,https://scholar.google.com/citations?view_op=view_citation&hl=en&user=ZRTiCX4AAAAJ&pagesize=50&citation_for_view=ZRTiCX4AAAAJ:anf4URPfarAC,"Controversy over public journalism wracked journalism scholars and practising journalists in the early 1990s, when it was advocated as solving two widening gaps: between political figures and citizens, and between news organizations and their readers. Declines in voter participation in elections, and more importantly in civic participation in public affairs, seemed to indicate that citizens were increasingly disengaged and were withdrawing from political processes. The public’s disaffection with political discourse and cynicism about government were at least partly blamed on journalism’s horse-race approach to campaigns and its treatment of politics as pivoting on self-interested tactics. That is, democracy was suffering. Journalists could help democracy by listening to people and trying to enhance civic commitment and participation in democratic processes."
26,What Does it Mean to be Literate in the Time of AI? Different Perspectives on Learning and Teaching AI Literacies in K-12 Education.,8,2024,https://scholar.google.com/citations?view_op=view_citation&hl=en&user=ZRTiCX4AAAAJ&pagesize=50&citation_for_view=ZRTiCX4AAAAJ:umqufdRvDiIC,"The pervasiveness of Artificial Intelligence/Machine Learning in the everyday lives of young people—impacting how they connect with friends, listen to music, play games, or attend school—coupled with the accessibility of applications powered by large language models and discussions about algorithmic justice has called for developing AI literacy in K-12 education. In this symposium, we offer different perspectives on what learning and teaching about AI could mean. Panelists will (1) address questions about how deeply do we want students to engage with AI,(2) examine in which ways critical agency can be developed, and (3) discuss implications for research and designs how teachers and learners can develop and integrate conceptual and critical understandings about Artificial Intelligence/Machine Learning that are increasingly important to participate in the world."
27,"Results of a phase 3 double-blind, placebo-controlled trial, Edema3 (R): A study of subcutaneous dx-88 (ecallantide) in patients with hereditary ancioedema",8,2008,https://scholar.google.com/citations?view_op=view_citation&hl=en&user=ZRTiCX4AAAAJ&pagesize=50&citation_for_view=ZRTiCX4AAAAJ:FAceZFleit8C,Description not available
28,Breaking down the visual barrier: Designing data interactions for the visually impaired in informal learning settings,7,2023,https://scholar.google.com/citations?view_op=view_citation&hl=en&user=ZRTiCX4AAAAJ&pagesize=50&citation_for_view=ZRTiCX4AAAAJ:_axFR9aDTf0C,"As data literacy takes an increasingly prominent role in education, learning sciences research is investigating how environments can be designed to foster sensemaking, including in informal environments. Yet, most efforts rely on visually-based data representations that remain inaccessible to blind and low vision learners. Work in human-computer interaction has explored solutions for human-data interactions that are accessible to visually impaired learners, but few have explored the intersection of data, informal learning, and visual impairment. Because informal science engagement is a strong influence toward developing STEM identities and pursuing STEM careers, neglecting to design informal science interactions for visually impaired learners can have long-term impact on participation in science. Here we review efforts toward supporting human-data interactions with scientific data for visually impaired learners, describe our interdisciplinary design efforts creating accessible auditory displays of oceanography data, and lay out an agenda toward designing accessible informal data interactions."
29,Do the data strike back? Students’ presentations of historical narratives about Latino communities using GIS,7,2012,https://scholar.google.com/citations?view_op=view_citation&hl=en&user=ZRTiCX4AAAAJ&pagesize=50&citation_for_view=ZRTiCX4AAAAJ:VOx2b1Wkg3QC,Description not available
30,Data bias recognition in museum settings: Framework development and contributing factors,6,2025,https://scholar.google.com/citations?view_op=view_citation&hl=en&user=ZRTiCX4AAAAJ&pagesize=50&citation_for_view=ZRTiCX4AAAAJ:HIFyuExEbWQC,"Critical thinking skills are increasingly important for comprehending our data-rich society. While museums provide data for discussion, visitors may not naturally question data in such displays due to the inherent authority of a museum. To investigate what factors can help visitors recognize bias in data, we interviewed visitors after they interacted with an augmented reality data map in an interactive data exhibition. Here, we present a qualitative analysis of fifteen semi-structured interviews with visitors who engaged with mapped data from the citizen science platform iNaturalist. The study revealed that 47% of participants were able to recognize bias, and familiarity was found to be a significant factor in this ability. We propose a three-layer framework to understand the cognitive processes of bias recognition in informal learning settings and apply this framework to our data to inform future work for designing displays to …"
31,Education Partnerships: A Co-Design Classroom for College Students with Intellectual and Developmental Disabilities,6,2024,https://scholar.google.com/citations?view_op=view_citation&hl=en&user=ZRTiCX4AAAAJ&pagesize=50&citation_for_view=ZRTiCX4AAAAJ:2VqYfGB8ITEC,"Co-design of technology encourages participation and decision-making input of end-users. In the case of technologies for individuals with Intellectual and Developmental Disabilities (IDD), the end-users are historically left out of the design process. Further deepening the disconnect between this group and technology, they are also excluded from formal technology design knowledge sharing, such as college courses. To address this, our study investigates the efficacy of a formal classroom adaptation of co-design activities to encourage learning and participation. Through collaboration between educators and designers, we adopted user-centered co-design activities to facilitate knowledge and application of technological design methods within a class of 13 students with IDD. Findings uncovered factors contributing to co-teaching collaboration planning and reflection between educators and designers, and ways that …"
32,Expanding access to ocean science through inclusively designed data sonifications,6,2023,https://scholar.google.com/citations?view_op=view_citation&hl=en&user=ZRTiCX4AAAAJ&pagesize=50&citation_for_view=ZRTiCX4AAAAJ:LO7wyVUgiFcC,"Look at a graph of oceanographic data. How would you convey the information only using sound? This is the challenge addressed by the US National Science Foundation-funded “Accessible Oceans” project, which seeks to increase access to ocean data in informal learning environments like museums, science centers, and aquariums. Quantitative information in these settings is almost always conveyed with visual displays. For audience members who are blind or have low vision, or those with data illiteracy or innumeracy, these displays remain inaccessible. In this article, we discuss our interdisciplinary project using an inclusive human-centered design process to develop auditory displays that support learning and understanding of ocean science in informal learning environments. We share information about our project and takeaways for inclusive auditory display design, hoping to inspire others to examine the …"
33,World Heritage Volcanoes: Classification,6,2019,https://scholar.google.com/citations?view_op=view_citation&hl=en&user=ZRTiCX4AAAAJ&pagesize=50&citation_for_view=ZRTiCX4AAAAJ:bKqednn6t2AC,Description not available
34,Exploring effects of full-body control in perspective-based learning in an interactive museum data display,6,2015,https://scholar.google.com/citations?view_op=view_citation&hl=en&user=ZRTiCX4AAAAJ&pagesize=50&citation_for_view=ZRTiCX4AAAAJ:geHnlv5EZngC,"Many factors are known to mediate museum visitors' learning during their interactions with exhibits, including designed elements of the exhibit itself, the other visitors present in the space, and visitors' own backgrounds and prior knowledge. Research indicates that learners' use of a first-person Actor perspective may confer agency to the learner and allow him to more easily reason about otherwise abstract concepts. Our preliminary research shows that full-body interaction with museum exhibits (specifically, an exhibit presenting a rich interactive data visualization), seems to promote both perspective-taking and improved data reasoning. This research builds on that work to clarify the affordances of perspective taking in mediating learning in this environment by comparing two methods of control of the interactive exhibit -- full-body and handheld -- in order to understand how each condition can support perspective …"
35,"Co-census: Designing an interactive museum space to prompt negotiated narratives of ethnicity, community, and identity",6,2012,https://scholar.google.com/citations?view_op=view_citation&hl=en&user=ZRTiCX4AAAAJ&pagesize=50&citation_for_view=ZRTiCX4AAAAJ:fQNAKQ3IYiAC,"This paper explores data collected during the pilot phase of an ongoing research program designing and studying an interactive data map to help museum visitors produce narratives about their ancestry and ethnic identities, and the distribution of such populations in a metropolitan area. A thematic map of ancestry data collected by the United States Census Bureau served as a vehicle to help visitors explore their own ancestry as well as that of their fellow visitors. By casting the locus of individuals’ identity onto an external artifact–a map of Cook County, Illinois–and shifting the focus from the individuals’ stories to the shape of communities at large, the exhibit was designed to promote observations, reflections, and conversations among visitors. This study reports on a pilot test of two initial sets of static maps in the first iteration of the design process, identifying ways visitors “emplotted”(Wertsch, 1998) the data maps with elements of social narratives. Five such elements were identified:(1) specific neighborhoods as anchors;(2) themes about immigrants’ motivations,(3) themes about neighborhood segregation;(4) familiar places as settings; and (5) characterizations of spatial features of the map image. Implications for iterative design are explored."
36,Connecting visitors to exhibits through design: Exploring United States census data with CoCensus,6,2012,https://scholar.google.com/citations?view_op=view_citation&hl=en&user=ZRTiCX4AAAAJ&pagesize=50&citation_for_view=ZRTiCX4AAAAJ:LPZeul_q3PIC,"This study presents preliminary results from a design-based research program examining ways to engage museum visitors in free-choice inquiry with geo-referenced census data, focusing on affording connections between ""big"" narratives about ancestry and migration, and ""little"" narratives about neighborhoods and personal identity. Preliminary findings have revealed affordances and tradeoffs in key design decisions that can be incorporated into ongoing iterations of the display."
37,"Ready, set, art: Technology needs and tools for remote K-2 art education",4,2022,https://scholar.google.com/citations?view_op=view_citation&hl=en&user=ZRTiCX4AAAAJ&pagesize=50&citation_for_view=ZRTiCX4AAAAJ:q3CdL3IzO_QC,"Art education plays a central role in early childhood development, and museum outreach programs can significantly enhance art education experiences for K-2 learners in schools. Increased demand for remote learning environments where students and teachers are not co-located has forced educational contexts to adopt technology-mediated learning. However, little research has investigated how technology can integrate museum content into fully remote, K-2 school art education. We elicited design requirements for K-2 art education platforms in a needs assessment study through surveys (N = 22) and interviews (N = 4) with educators. We created a typology of existing platforms, which we evaluated against these requirements. We identified a key unmet need for students to receive feedback on their fine motor skills, and, in response, we created a prototype system with interactive scissors called Chameleon …"
38,Serving the needs of the Latina community for health information,4,2015,https://scholar.google.com/citations?view_op=view_citation&hl=en&user=ZRTiCX4AAAAJ&pagesize=50&citation_for_view=ZRTiCX4AAAAJ:p__nRnzSRKYC,"Latinos remain the largest US population with limited health literacy (Andrulis DP & Brach, 2007). Concerned with how local media can meet the information needs of underserved audiences, we interviewed Latinas who were pregnant or mothers of young children living in a Spanish speaking community, and surveyed 33 local health professionals. Findings are that Latina women’s most common source of health information was family and friends. They said they tune to Spanish television and radio programs, but gave low grades to news media for health information. Medical professionals agreed that Latinas generally get their health information through friends and family, and rated the media poorly in terms of serving Latinas’ needs. Since the data indicate that the local news media are not serving Latinas’ health information needs as much as they could, we offer recommendations to potentially exploit new technological affordances and suggest expansion of conventional definitions of health literacy."
39,Synergistic scaffolding of technologically-enhanced STEM learning in informal institutions,4,2014,https://scholar.google.com/citations?view_op=view_citation&hl=en&user=ZRTiCX4AAAAJ&pagesize=50&citation_for_view=ZRTiCX4AAAAJ:Mojj43d5GZwC,"Scaffolding is often strongly associated with the structure of classroom educational software (Quintana et al., 2004), despite originally not involving classrooms or technology (Wood et al., 2007). Tabak argued that scaffolding can be productively distributed across a learning environment's varied educational resources, proposing a ""synergistic scaffolding"" design pattern: ""different supports that augment each other; they interact and work in concert to guide a single performance of a task or goal"" (Tabak, 2004). This symposium argues that synergistic scaffolding is particularly apt for informal learning environments like museums, where visitors draw on a diverse array of technological, social, and physical resources while learning. Examples spanning collaborative data exploration, multi-context inquiry learning, mixed-reality simulations, and augmented reality exhibits are presented. Each details the educational resources either intentionally designed into the environments or appropriated by visitors as they learn. These examples highlight how designers can enhance informal learning by looking for potential synergies."
40,Theoretical Foundations: Embodiment,3,2026,https://scholar.google.com/citations?view_op=view_citation&hl=en&user=ZRTiCX4AAAAJ&pagesize=50&citation_for_view=ZRTiCX4AAAAJ:PoWvk5oyLR8C,"The previous chapter introduced Human-Data Interaction (HDI) as a way to leverage our deeply ingrained mental patterns for more intuitive and meaningful data exploration. But how do we tap into these fundamental patterns of understanding? This chapter provides the essential theoretical foundations for understanding, designing, and assessing HDI systems. Grounded in sociocultural theories of cognition and learning, HDI leverages the connection between our physical bodies and our cognitive processes."
41,Iterative Design of Auditory Displays involving Data Sonifications and Authentic Ocean Data,3,2024,https://scholar.google.com/citations?view_op=view_citation&hl=en&user=ZRTiCX4AAAAJ&pagesize=50&citation_for_view=ZRTiCX4AAAAJ:_5tno0g5mFcC,"The “Accessible Oceans” pilot project aims to inclusively design auditory displays that support perception and understanding of ocean data in informal learning environments (ILEs). The project’s multi-disciplinary team includes expertise from all related fields — ocean scientists, dataset experts, a sound designer with specialization in data sonification, and a learning sciences researcher. In addition, the PI is blind and provides a crucial perspective in our research. We describe the sound design of informative sonifications and respective auditory displays based on iterative design with user input at each stage, including from blind and low-vision (BLV) students, their teachers, and subject-matter experts. We discuss the importance of framing data sonifications through an auditory presentation of contextual information. We also report on our latest auditory display evaluation using Auditory Interface UX Scale (BUZZ) surveys at three ILE test sites. These responses further affirm our auditory display design developments. We include access to the auditory displays media and lessons learned over the course of this multi-year NSF-funded Advancing Informal Stem Learning (AISL) grant https://accessibleoceans.whoi.edu/"
42,"The deconstruction of volcanic risk, case study: Galeras, Colombia",3,2015,https://scholar.google.com/citations?view_op=view_citation&hl=en&user=ZRTiCX4AAAAJ&pagesize=50&citation_for_view=ZRTiCX4AAAAJ:5qfkUJPXOUwC,"History has shown that the combination of active volcanism and human populations can lead to devastating consequences, which at their most extreme have resulted in the collapse of entire societies. However these losses have not only been attributed to the impact of volcanic hazards but also the management strategies put in place to try to mitigate them, criticised for the detrimental long-term socio-economic impacts they have had on communities involved. General risk management theory argues that the failure of risk management strategies can be in part due to the poor risk assessment methodologies used to inform decision-making. ‘Insufficient’ or ‘inaccurate’ data is often attributed to disciplinary biases, a weakness in methodological tools and a focus on top down prescriptive approaches lacking in participation from those living with the risks in question. This thesis, acknowledging these broader debates, examines whether the way in which volcanic risk is assessed is fully representative of the complexities of the relationship between society and volcanoes. Using an empirical study of communities living on the Galeras volcano in Colombia, it compares the public experience of risk with the way in which it is interpreted and measured within Volcanology. Results of the study show that whilst previous volcanic risk assessments have been strong in their ability to capture data on volcanic hazards, assessment methods have been significantly weaker in their ability to address the threat of other non-volcanic hazards, social vulnerability and the social, economic and cultural value of the volcano environment. This thesis argues that a more …"
43,Harnessing motion-sensing technologies to engage visitors with digital data,3,2015,https://scholar.google.com/citations?view_op=view_citation&hl=en&user=ZRTiCX4AAAAJ&pagesize=50&citation_for_view=ZRTiCX4AAAAJ:sSrBHYA8nusC,"Data is an increasingly important part of how we understand the world around us, but making abstract and complex data sets accessible to museum visitors can pose a significant challenge. The CoCensus exhibit, installed at the New York Hall of Science, seeks to engage visitors in exploring mapped census data and encourage reasoning about the spatial, temporal, and quantitative properties of the data set through a customizable, interactive multiuser exhibit. This paper discusses two major design challenges in creating this novel exhibit, which utilizes embodied interaction to let visitors use their body movements to “play” with digital representations of data in a collaborative learning space. The first challenge was providing an"" entry point"" to engage visitors with the abstract data set, which was accomplished by allowing visitors to select personally relevant subsets of the census data and dynamically control how those subsets were displayed. Using motion-sensing technologies to situate this control in multiple users’ bodies through movements and gestures addressed the second challenge of engaging multiple participants, who were now able to coordinate their actions to jointly explore their data. This paper will discuss design iterations of CoCensus to describe how motion-sensing technologies have been harnessed to transform the floor space of an exhibit into an interactive timeline, demonstrating that museums can play a role in helping visitors develop data-reasoning skills, playfully and collaboratively."
44,Keeping It Real: A Historical Look at Reality TV,3,2011,https://scholar.google.com/citations?view_op=view_citation&hl=en&user=ZRTiCX4AAAAJ&pagesize=50&citation_for_view=ZRTiCX4AAAAJ:M7yex6snE4oC,"In the summer of 2000 CBS launched a wilderness and competition reality show called “Survivor.” The show became a monster hit with more than fifty million viewers watching the finale, ratings only second to Super Bowl. That summer and that show forever changed many aspects of the television industry. Reality TV had been around for years, but with “Survivor” it began a period of lightening fast development, growth, and influence. During the past decade, many different reality shows have emerged and this research categorizes those shows into four sub-genres that it is argued all reality shows during this time could fit into. Those genres, and the hybrids of them that are still emerging, will play a huge part in how television in the future is created, financed, and produced. In addition, reality TV and all its genres have expanded what is considered acceptable as scripted and unscripted broadcast content in less than …"
45,Spatio-temporal movement of livestock in relation to decreasing pasture biomass.,3,2010,https://scholar.google.com/citations?view_op=view_citation&hl=en&user=ZRTiCX4AAAAJ&pagesize=50&citation_for_view=ZRTiCX4AAAAJ:Y5dfb0dijaUC,"The use of spatio-temporal livestock monitoring to investigate animal behaviour in relation to available biomass has the potential to improve pasture utilisation in rotational grazing systems. The aim of this study was to examine if movement metrics derived from GPS monitoring could identify variations in animal behaviour in response to decreasing pasture availability. GPS tracking collars were deployed on six cattle grazing for 46 days and data analysed to determine grazing time and spatial variation in utilisation. Unexpectedly, grazing time did not seem to be affected by decreasing pasture biomass. However, spatial utilisation of the paddock appeared to increase as biomass decreased."
