Rank,Title,Citations,Year,URL,Description
1,X10: an object-oriented approach to non-uniform cluster computing,2056,2005,https://scholar.google.com/citations?view_op=view_citation&hl=en&user=XjeIqxYAAAAJ&pagesize=50&citation_for_view=XjeIqxYAAAAJ:d1gkVwhDpl0C,"It is now well established that the device scaling predicted by Moore's Law is no longer a viable option for increasing the clock frequency of future uniprocessor systems at the rate that had been sustained during the last two decades. As a result, future systems are rapidly moving from uniprocessor to multiprocessor configurations, so as to use parallelism instead of frequency scaling as the foundation for increased compute capacity. The dominant emerging multiprocessor structure for the future is a Non-Uniform Cluster Computing (NUCC) system with nodes that are built out of multi-core SMP chips with non-uniform memory hierarchies, and interconnected in horizontally scalable cluster configurations such as blade servers. Unlike previous generations of hardware evolution, this shift will have a major impact on existing software. Current OO language facilities for concurrent and distributed programming are …"
2,Partitioning and scheduling parallel programs for execution on multiprocessors,1267,1987,https://scholar.google.com/citations?view_op=view_citation&hl=en&user=XjeIqxYAAAAJ&pagesize=50&citation_for_view=XjeIqxYAAAAJ:u5HHmVD_uO8C,"There are three fundamental problems to be solved in the execution of a parallel program on a multiprocessor--identifying the parallelism in the program, partitioning the program into tasks and scheduling the tasks on processors. Whereas the problem of identifying parallelism is a programming language issue, the partitioning and scheduling problems are intimately related to parameters of the target multiprocessor, like the number of processors and synchronisation and communication overhead. It is desirable for the partitioning and scheduling to be performed automatically, so that the same parallel program can execute efficiently on different multiprocessors. This dissertation presents two solutions to the partitioning and scheduling problems. The first approach is based on a macro-dataflow model, where the program is partitioned into tasks at compile-time and the tasks are scheduled on processors at run-time …"
3,Baring it all to software: Raw machines,1033,1997,https://scholar.google.com/citations?view_op=view_citation&hl=en&user=XjeIqxYAAAAJ&pagesize=50&citation_for_view=XjeIqxYAAAAJ:u-x6o8ySG0sC,"The most radical of the architectures that appear in this issue are Raw processors-highly parallel architectures with hundreds of very simple processors coupled to a small portion of the on-chip memory. Each processor, or tile, also contains a small bank of configurable logic, allowing synthesis of complex operations directly in configurable hardware. Unlike the others, this architecture does not use a traditional instruction set architecture. Instead, programs are compiled directly onto the Raw hardware, with all units told explicitly what to do by the compiler. The compiler even schedules most of the intertile communication. The real limitation to this architecture is the efficacy of the compiler. The authors demonstrate impressive speedups for simple algorithms that lend themselves well to this architectural model, but whether this architecture will be effective for future workloads is an open question."
4,The Jalapeno virtual machine,807,2000,https://scholar.google.com/citations?view_op=view_citation&hl=en&user=XjeIqxYAAAAJ&pagesize=50&citation_for_view=XjeIqxYAAAAJ:9yKSN-GCB0IC,"Jalapeño is a virtual machine for Java™ servers written in the Java language. To be able to address the requirements of servers (performance and scalability in particular), Jalapeño was designed “from scratch“ to be as self-sufficient as possible. Jalapeño's unique object model and memory layout allows a hardware null-pointer check as well as fast access to array elements, fields, and methods. Run-time services conventionally provided in native code are implemented primarily in Java. Java threads are multiplexed by virtual processors (implemented as operating system threads). A family of concurrent object allocators and parallel type-accurate garbage collectors is supported. Jalapeño's interoperable compilers enable quasi-preemptive thread switching and precise location of object references. Jalapeño's dynamic optimizing compiler is designed to obtain high quality code for methods that are observed to be …"
5,Linear scan register allocation,584,1999,https://scholar.google.com/citations?view_op=view_citation&hl=en&user=XjeIqxYAAAAJ&pagesize=50&citation_for_view=XjeIqxYAAAAJ:IjCSPb-OGe4C,"We describe a new algorithm for fast global register allocation called linear scan. This algorithm is not based on graph coloring, but allocates registers to variables in a single linear-time scan of the variables' live ranges. The linear scan algorithm is considerably faster than algorithms based on graph coloring, is simple to implement, and results in code that is almost as efficient as that obtained using more complex and time-consuming register allocators based on graph coloring. The algorithm is of interest in applications where compile time is a concern, such as dynamic compilation systems, “just-in-time” compilers, and interactive development environments."
6,Efficient and precise datarace detection for multithreaded object-oriented programs,534,2002,https://scholar.google.com/citations?view_op=view_citation&hl=en&user=XjeIqxYAAAAJ&pagesize=50&citation_for_view=XjeIqxYAAAAJ:qjMakFHDy7sC,"We present a novel approach to dynamic datarace detection for multithreaded object-oriented programs. Past techniques for on-the-fly datarace detection either sacrificed precision for performance, leading to many false positive datarace reports, or maintained precision but incurred significant overheads in the range of 3x to 30x. In contrast, our approach results in very few false positives and runtime overhead in the 13% to 42% range, making it both efficient and precise. This performance improvement is the result of a unique combination of complementary static and dynamic optimization techniques."
7,"Understanding reuse, performance, and hardware cost of dnn dataflow: A data-centric approach",444,2019,https://scholar.google.com/citations?view_op=view_citation&hl=en&user=XjeIqxYAAAAJ&pagesize=50&citation_for_view=XjeIqxYAAAAJ:SAZ1SQo2q1kC,"The data partitioning and scheduling strategies used by DNN accelerators to leverage reuse and perform staging are known as dataflow, which directly impacts the performance and energy efficiency of DNN accelerators. An accelerator micro architecture dictates the dataflow(s) that can be employed to execute layers in a DNN. Selecting a dataflow for a layer can have a large impact on utilization and energy efficiency, but there is a lack of understanding on the choices and consequences of dataflow, and of tools and methodologies to help architects explore the co-optimization design space. In this work, we first introduce a set of data-centric directives to concisely specify the DNN dataflow space in a compiler-friendly form. We then show how these directives can be analyzed to infer various forms of reuse and to exploit them using hardware capabilities. We codify this analysis into an analytical cost model …"
8,The Jalapeno dynamic optimizing compiler for Java,424,1999,https://scholar.google.com/citations?view_op=view_citation&hl=en&user=XjeIqxYAAAAJ&pagesize=50&citation_for_view=XjeIqxYAAAAJ:2osOgNQ5qMEC,"The Jalapeiio Dynamic Optimizing Compiler is a key component of the Jalapeiio Virtual Machine, a new Java’Virtual Machine (JVM) designed to support efficient and scalable execution of Java applications on SMP server machines. This paper describes the design of the Jalapefio Optimizing Compiler, and the implementation results that we have obtained thus far. To the best of our knowledge, this is the first dynamic optimizing compiler for Java that is being used in a JVM with a compile-only approach to program execution."
9,Space-time scheduling of instruction-level parallelism on a raw machine,394,1998,https://scholar.google.com/citations?view_op=view_citation&hl=en&user=XjeIqxYAAAAJ&pagesize=50&citation_for_view=XjeIqxYAAAAJ:UeHWp8X0CEIC,"Increasing demand for both greater parallelism and faster clocks dictate that future generation architectures will need to decentralize their resources and eliminate primitives that require single cycle global communication. A Raw microprocessor distributes all of its resources, including instruction streams, register files, memory ports, and ALUs, over a pipelined two-dimensional mesh interconnect, and exposes them fully to the compiler. Because communication in Raw machines is distributed, compiling for instruction-level parallelism (ILP) requires both spatial instruction partitioning as well as traditional temporal instruction scheduling. In addition, the compiler must explicitly manage all communication through the interconnect, including the global synchronization required at branch points. This paper describes RAWCC, the compiler we have developed for compiling general-purpose sequential programs to the …"
10,The Jikes Research Virtual Machine project: Building an open-source research community,357,2005,https://scholar.google.com/citations?view_op=view_citation&hl=en&user=XjeIqxYAAAAJ&pagesize=50&citation_for_view=XjeIqxYAAAAJ:ufrVoPGSRksC,"This paper describes the evolution of the Jikes™ Research Virtual Machine project from an IBM internal research project, called Jalapeño, into an open-source project. After summarizing the original goals of the project, we discuss the motivation for releasing it as an open-source project and the activities performed to ensure the success of the project. Throughout, we highlight the unique challenges of developing and maintaining an open-source project designed specifically to support a research community."
11,ABCD: eliminating array bounds checks on demand,350,2000,https://scholar.google.com/citations?view_op=view_citation&hl=en&user=XjeIqxYAAAAJ&pagesize=50&citation_for_view=XjeIqxYAAAAJ:zYLM7Y9cAGgC,"To guarantee typesafe execution, Java and other strongly typed languages require bounds checking of array accesses. Because array-bounds checks may raise exceptions, they block code motion of instructions with side effects, thus preventing many useful code optimizations, such as partial redundancy elimination or instruction scheduling of memory operations. Furthermore, because it is not expressible at bytecode level, the elimination of bounds checks can only be performed at run time, after the bytecode program is loaded. Using existing powerful bounds-check optimizers at run time is not feasible, however, because they are too heavyweight for the dynamic compilation setting. ABCD is a light-weight algorithm for elimination of Array Bounds Checks on Demand. Its design emphasizes simplicity and efficiency. In essence, ABCD works by adding a few edges to the SSA value graph and performing a simple …"
12,Habanero-Java: the new adventures of old X10,324,2011,https://scholar.google.com/citations?view_op=view_citation&hl=en&user=XjeIqxYAAAAJ&pagesize=50&citation_for_view=XjeIqxYAAAAJ:isC4tDSrTZIC,"In this paper, we present the Habanero-Java (HJ) language developed at Rice University as an extension to the original Java-based definition of the X10 language. HJ includes a powerful set of task-parallel programming constructs that can be added as simple extensions to standard Java programs to take advantage of today's multi-core and heterogeneous architectures. The language puts a particular emphasis on the usability and safety of parallel constructs. For example, no HJ program using async, finish, isolated, and phaser constructs can create a logical deadlock cycle. In addition, the future and data-driven task variants of the async construct facilitate a functional approach to parallel programming. Finally, any HJ program written with async, finish, and phaser constructs that is data-race free is guaranteed to also be deterministic. HJ also features two key enhancements that address well known limitations in …"
13,"Maestro: A data-centric approach to understand reuse, performance, and hardware cost of dnn mappings",288,2020,https://scholar.google.com/citations?view_op=view_citation&hl=en&user=XjeIqxYAAAAJ&pagesize=50&citation_for_view=XjeIqxYAAAAJ:KWzIFqRkAKkC,"The efficiency of an accelerator depends on three factors-mapping, deep neural network (DNN) layers, and hardware-constructing extremely complicated design space of DNN accelerators. To demystify such complicated design space and guide the DNN accelerator design for better efficiency, we propose an analytical cost model, MAESTRO. MAESTRO receives DNN model description and hardware resources information as a list, and mapping described in a data-centric representation we propose as inputs. The data-centric representation consists of three directives that enable concise description of mappings in a compiler-friendly form. MAESTRO analyzes various forms of data reuse in an accelerator based on inputs quickly and generates more than 20 statistics including total latency, energy, throughput, etc., as outputs. MAESTRO's fast analysis enables various optimization tools for DNN accelerators such as …"
14,Decentralizing execution of composite web services,270,2004,https://scholar.google.com/citations?view_op=view_citation&hl=en&user=XjeIqxYAAAAJ&pagesize=50&citation_for_view=XjeIqxYAAAAJ:YsMSGLbcyi4C,"Distributed enterprise applications today are increasingly being built from services available over the web. A unit of functionality in this framework is a web service, a software application that exposes a set of ""typed'' connections that can be accessed over the web using standard protocols. These units can then be composed into a composite web service. BPEL (Business Process Execution Language) is a high-level distributed programming language for creating composite web services. Although a BPEL program invokes services distributed over several servers, the orchestration of these services is typically under centralized control. Because performance and throughput are major concerns in enterprise applications, it is important to remove the inefficiencies introduced by the centralized control. In a distributed, or decentralized orchestration, the BPEL program is partitioned into independent sub-programs that …"
15,Determining average program execution times and their variance,263,1989,https://scholar.google.com/citations?view_op=view_citation&hl=en&user=XjeIqxYAAAAJ&pagesize=50&citation_for_view=XjeIqxYAAAAJ:Tyk-4Ss8FVUC,"This paper presents a general framework for determining average program execution times and their variance, based on the program's interval structure and control dependence graph. Average execution times and variance values are computed using frequency information from an optimized counter-based execution profile of the program."
16,On estimating and enhancing cache effectiveness,245,1991,https://scholar.google.com/citations?view_op=view_citation&hl=en&user=XjeIqxYAAAAJ&pagesize=50&citation_for_view=XjeIqxYAAAAJ:Y0pCki6q_DkC,"In this paper, we consider automatic analysis of a program's cache usage to achieve greater cache effectiveness. We show how to estimate efficiently the number of distinct cache lines used by a given loop in a nest of loops. Given this estimate of the number of cache lines needed, we can estimate the number of cache misses for a nest of loops. Our estimates can be used to guide program transformations such as loop interchange to achieve greater cache effectiveness. We present simulation results that show our estimates are reasonable for simple cases such as matrix multiply. We analyze the array sizes for which our estimates differ from our simulation results, and provide recommendations on how to handle such arrays in practice."
17,Slaw: a scalable locality-aware adaptive work-stealing scheduler for multi-core systems,238,2010,https://scholar.google.com/citations?view_op=view_citation&hl=en&user=XjeIqxYAAAAJ&pagesize=50&citation_for_view=XjeIqxYAAAAJ:_Qo2XoVZTnwC,"This poster introduces SLAW, a Scalable Locality-aware Adaptive Work-stealing scheduler. The SLAW features an adaptive task scheduling algorithm combined with a locality-aware scheduling framework. Past work has demonstrated the pros and cons of using fixed scheduling policies, such as work-first and help-first, in different cases without a clear winner. Prior work also assumes the availability and successful execution of a serial version of the parallel program. This assumption can limit the expressiveness of dynamic task parallel languages. The SLAW scheduler supports both work-first and help-first policies simultaneously. It does so by using an adaptive approach that selects a scheduling policy on a per-task basis at runtime. The SLAW scheduler also establishes bounds on the stack usage and the heap space needed to store tasks. The experimental results for the benchmarks studied show that SLAW's …"
18,JCUDA: A programmer-friendly interface for accelerating Java programs with CUDA,237,2009,https://scholar.google.com/citations?view_op=view_citation&hl=en&user=XjeIqxYAAAAJ&pagesize=50&citation_for_view=XjeIqxYAAAAJ:IWHjjKOFINEC,"A recent trend in mainstream desktop systems is the use of general-purpose graphics processor units (GPGPUs) to obtain order-of-magnitude performance improvements. CUDA has emerged as a popular programming model for GPGPUs for use by C/C++ programmers. Given the widespread use of modern object-oriented languages with managed runtimes like Java and C#, it is natural to explore how CUDA-like capabilities can be made accessible to those programmers as well. In this paper, we present a programming interface called JCUDA that can be used by Java programmers to invoke CUDA kernels. Using this interface, programmers can write Java codes that directly call CUDA kernels, and delegate the responsibility of generating the Java-CUDA bridge codes and host-device data transfer calls to the compiler. Our preliminary performance results show that this interface can deliver significant performance …"
19,Compile-time partitioning and scheduling of parallel programs,235,1986,https://scholar.google.com/citations?view_op=view_citation&hl=en&user=XjeIqxYAAAAJ&pagesize=50&citation_for_view=XjeIqxYAAAAJ:W7OEmFMy1HYC,Partitioning and scheduling techniques are necessary to implement parallel languages on multiprocessors. Multiprocessor performance is maximized when parallelism between tasks is optimally traded off with communication and synchronization overhead. We present compile-time partitioning and scheduling techniques to achieve this trade-off.
20,The opportunities and challenges of exascale computing,231,2010,https://scholar.google.com/citations?view_op=view_citation&hl=en&user=XjeIqxYAAAAJ&pagesize=50&citation_for_view=XjeIqxYAAAAJ:LdasjJ6CEcoC,Description not available
21,Concurrent collections,231,2010,https://scholar.google.com/citations?view_op=view_citation&hl=en&user=XjeIqxYAAAAJ&pagesize=50&citation_for_view=XjeIqxYAAAAJ:GnPB-g6toBAC,"We introduce the Concurrent Collections (CnC) programming model. CnC supports flexible combinations of task and data parallelism while retaining determinism. CnC is implicitly parallel, with the user providing high‐level operations along with semantic ordering constraints that together form a CnC graph. We formally describe the execution semantics of CnC and prove that the model guarantees deterministic computation. We evaluate the performance of CnC implementations on several applications and show that CnC offers performance and scalability equivalent to or better than that offered by lower‐level parallel programming models."
22,Array SSA form and its use in parallelization,222,1998,https://scholar.google.com/citations?view_op=view_citation&hl=en&user=XjeIqxYAAAAJ&pagesize=50&citation_for_view=XjeIqxYAAAAJ:eQOLeE2rZwMC,"Static single assignment (SSA) form for scalars has been a significant advance. It has simplified the way we think about scalar variables. It has simplified the design of some optimizations and has made other optimizations more effective. Unfortunately none of this can be be said for SSA form for arrays. The current SSA processing of arrays views an array as a single object. But the kinds of analyses that sophisticated compilers need to perform on arrays, for example those that drive loop parallelization, are at the element level. Current SSA form for arrays is incapable of providing the element-level data flow information required for such analyses.In this paper, we introduce an Array SSA form that captures precise element-level data flow information for array variables in all cases. It is general and simple, and coincides with standard SSA form when applied to scalar variables. It can also be used for structures and other …"
23,Work-first and help-first scheduling policies for async-finish task parallelism,215,2009,https://scholar.google.com/citations?view_op=view_citation&hl=en&user=XjeIqxYAAAAJ&pagesize=50&citation_for_view=XjeIqxYAAAAJ:Wp0gIr-vW9MC,"Multiple programming models are emerging to address an increased need for dynamic task parallelism in applications for multicore processors and shared-address-space parallel computing. Examples include OpenMP 3.0, Java Concurrency Utilities, Microsoft Task Parallel Library, Intel Thread Building Blocks, Cilk, X10, Chapel, and Fortress. Scheduling algorithms based on work stealing, as embodied in Cilk's implementation of dynamic spawn-sync parallelism, are gaining in popularity but also have inherent limitations. In this paper, we address the problem of efficient and scalable implementation of X10's async-finish task parallelism, which is more general than Cilk's spawn-sync parallelism. We introduce a new work-stealing scheduler with compiler support for async-finish task parallelism that can accommodate both work-first and help-first scheduling policies. Performance results on two different multicore SMP …"
24,Software challenges in extreme scale systems,186,2009,https://scholar.google.com/citations?view_op=view_citation&hl=en&user=XjeIqxYAAAAJ&pagesize=50&citation_for_view=XjeIqxYAAAAJ:RGFaLdJalmkC,"Computer systems anticipated in the 2015 – 2020 timeframe are referred to as Extreme Scale because they will be built using massive multi-core processors with 100's of cores per chip. The largest capability Extreme Scale system is expected to deliver Exascale performance of the order of 1018 operations per second. These systems pose new critical challenges for software in the areas of concurrency, energy efficiency and resiliency. In this paper, we discuss the implications of the concurrency and energy efficiency challenges on future software for Extreme Scale Systems. From an application viewpoint, the concurrency and energy challenges boil down to the ability to express and manage parallelism and locality by exploring a range of strong scaling and new-era weak scaling techniques. For expressing parallelism and locality, the key challenges are the ability to expose all of the intrinsic parallelism and locality …"
25,Collective loop fusion for array contraction,181,1992,https://scholar.google.com/citations?view_op=view_citation&hl=en&user=XjeIqxYAAAAJ&pagesize=50&citation_for_view=XjeIqxYAAAAJ:_FxGoFyzp5QC,"In this paper we propose a loop fusion algorithm specifically designed to increase opportunities for array contraction. Array contraction is an optimization that transforms array variables into scalar variables within a loop nest. In contrast to array elements, scalar variables have better cache behavior and can be allocated to registers. In past work we investigated loop interchange and loop reversal as optimizations that increase opportunities for array contraction [13]. This paper extends this work by including the loop fusion optimization. The fusion method discussed in this paper uses the maxflow-mincut algorithm to do loop clustering. Our collective loop fusion algorithm is efficient, and we demonstrate its usefulness for array contraction with a simple example."
26,Phasers: a unified deadlock-free construct for collective and point-to-point synchronization,173,2008,https://scholar.google.com/citations?view_op=view_citation&hl=en&user=XjeIqxYAAAAJ&pagesize=50&citation_for_view=XjeIqxYAAAAJ:Zph67rFs4hoC,"Coordination and synchronization of parallel tasks is a major source of complexity in parallel programming. These constructs take many forms in practice including mutual exclusion in accesses to shared resources, termination detection of child tasks, collective barrier synchronization, and point-to-point synchronization. In this paper, we introduce phasers, a new coordination construct that unifies collective and point-to-point synchronizations. We establish two safety properties for phasers: deadlock-freedom and phase-ordering. Performance results obtained from a portable implementation of phasers on three different SMP platforms demonstrate that phasers can deliver superior performance to existing barrier implementations, in addition to the productivity benefits that result from their generality and safety properties."
