Rank,Title,Citations,Year,URL,Description
27,Efficient and precise modeling of exceptions for the analysis of Java programs,170,1999,https://scholar.google.com/citations?view_op=view_citation&hl=en&user=XjeIqxYAAAAJ&pagesize=50&citation_for_view=XjeIqxYAAAAJ:WF5omc3nYNoC,"The Factored Control Flow Graph, FCFG, is a novel representation of a program's intraprocedural control flow, which is designed to efficiently support the analysis of programs written in languages, such as Java, that have frequently occurring operations whose execution may result in exceptional control flow. The FCFG is more compact than traditional CFG representations for exceptional control flow, yet there is no loss of precision in using the FCFG. In this paper, we introduce the FCFG representation and outline how standard forward and backward data flow analysis algorithms can be adapted to work on this representation. We also present empirical measurements of FCFG sizes for a large number of methods obtained from a variety of Java programs, and compare these sizes with those of a traditional CFG representation."
28,Retargeting optimized code by matching tree patterns in directed acyclic graphs,162,2001,https://scholar.google.com/citations?view_op=view_citation&hl=en&user=XjeIqxYAAAAJ&pagesize=50&citation_for_view=XjeIqxYAAAAJ:qxL8FJ1GzNcC,"An optimizing, compiler that performs retargetable object code generation for a speci? c processor by matching tree patterns in directed acyclic graphs derived from the source code."
29,Customizable domain-specific computing,160,2010,https://scholar.google.com/citations?view_op=view_citation&hl=en&user=XjeIqxYAAAAJ&pagesize=50&citation_for_view=XjeIqxYAAAAJ:YFjsv_pBGBYC,"To meet computing needs and overcome power density limitations, the computing industry has entered the era of parallelization. However, highly parallel, general-purpose computing systems face serious challenges in terms of performance, energy, heat dissipation, space, and cost. We believe that there is significant opportunity to look beyond parallelization and focus on domain-specific customization to bring significant power-performance efficiency improvement."
30,Optimized unrolling of nested loops,156,2000,https://scholar.google.com/citations?view_op=view_citation&hl=en&user=XjeIqxYAAAAJ&pagesize=50&citation_for_view=XjeIqxYAAAAJ:8k81kl-MbHgC,"In this paper, we address the problems of automatically selecting unroll factors for perfectly nested loops, and generating compact code for the selected unroll factors. Compared to past work, the contributions of our work include a) a more detailed cost model that includes ILP and 1-cache considerations, b) a new code generation algorithm for unrolling nested loops that generates more compact code (with fewer remainder loops) than the unroll-and-jam transformation, and c) a new algorithm for efficiently enumerating feasible unroll vectors.Our experimental results confirm the wide applicability of our approach by showing a 2.2X speedup on matrix multiply, and an average 1.08X speedup on seven of the SPEC95fp benchmarks (with a 1.2X speedup for two benchmarks). These speedups are significant because the baseline compiler used for comparison is the IBM XL Fortran product compiler which generates high …"
31,Partitioning parallel programs for macro-dataflow,155,1986,https://scholar.google.com/citations?view_op=view_citation&hl=en&user=XjeIqxYAAAAJ&pagesize=50&citation_for_view=XjeIqxYAAAAJ:LkGwnXOMwfcC,"Abstract Partitioni,~.. teclm/qucs are necessary to execute functional Inegra~ at• coarse Srenel~ ty. Fine srenul~ ty execution is inefficient on general purpose multiprocettars. There Ls• trado-off between pm'elkllsm and the overhead of exploiting parallelism. W e~ t• compile-time partitioning approach to achieve~ U~ le~ off."
32,Exascale software study: Software challenges in extreme scale systems,152,2009,https://scholar.google.com/citations?view_op=view_citation&hl=en&user=XjeIqxYAAAAJ&pagesize=50&citation_for_view=XjeIqxYAAAAJ:RYcK_YlVTxYC,"Extreme Scale processors containing hundreds or even thousands of cores will challenge current operating system (OS) practices. Many of the fundamental assumptions that underlie current OS technology are based on design assumptions that are no longer valid for a Extreme Scale processor containing thousands of cores. In the context of Exascale system requirements, as machines grow in scale and complexity, techniques to make the most effective use of network, memory, processor, and energy resources are becoming increasingly important. In its role as gate-keeper to all these resources, the OS becomes a major obstacle in allowing the application to view the hardware in accordance with the Extreme Scale Execution Model outlined in Section 3.1. A baseline challenge for the exascale software stack is: how to reduce OS overheads without compromising the need to protect hardware state from errant or malicious software. Execution models that support more asynchrony will be necessary to hide latency. Such execution models will also require more carefully coordinated scheduling to balance resource utilization"
33,Top ten exascale research challenges,143,2014,https://scholar.google.com/citations?view_op=view_citation&hl=en&user=XjeIqxYAAAAJ&pagesize=50&citation_for_view=XjeIqxYAAAAJ:ymY9cBF3mdcC,Description not available
34,Scalable and precise dynamic datarace detection for structured parallelism,142,2012,https://scholar.google.com/citations?view_op=view_citation&hl=en&user=XjeIqxYAAAAJ&pagesize=50&citation_for_view=XjeIqxYAAAAJ:_Ybze24A_UAC,"Existing dynamic race detectors suffer from at least one of the following three limitations: (i)space overhead per memory location grows linearly with the number of parallel threads [13], severely limiting the parallelism that the algorithm can handle; (ii)sequentialization: the parallel program must be processed in a sequential order, usually depth-first [12, 24]. This prevents the analysis from scaling with available hardware parallelism, inherently limiting its performance; (iii) inefficiency: even though race detectors with good theoretical complexity exist, they do not admit efficient implem entations and are unsuitable for practical use [4, 18]. We present a new precise dynamic race detector that leverages structured parallelism in order to address these limitations. Our algorithm requires constant space per memory location, works in parallel, and is efficient in practice. We implemented and evaluated our algorithm on a set of …"
35,Automatic partitioning of a program dependence graph into parallel tasks,142,1991,https://scholar.google.com/citations?view_op=view_citation&hl=en&user=XjeIqxYAAAAJ&pagesize=50&citation_for_view=XjeIqxYAAAAJ:UebtZRa9Y70C,"In this paper, we describe a general interprocedural framework for partitioning a program dependence graph into parallel tasks for execution on a multiprocessor system. Partitioning techniques are necessary to execute a parallel program at the appropriate granularity for a given target multiprocessor. The problem is to determine the best trade-off between parallelism and overhead. It is desirable for the partitioning to be performed automatically, so that the programmer can write a parallel program without being burdened by details of the overhead target multiprocessor, and so that the same parallel program can be made to execute efficiently on different multiprocessors. For each procedure, the partitioning algorithm attempts to minimize the estimated parallel execution time. The estimated parallel execution time reflects a trade-off between parallelism and overhead and is minimized at an optimal intermediate …"
36,Hierarchical place trees: A portable abstraction for task parallelism and data movement,141,2009,https://scholar.google.com/citations?view_op=view_citation&hl=en&user=XjeIqxYAAAAJ&pagesize=50&citation_for_view=XjeIqxYAAAAJ:TQgYirikUcIC,"Modern computer systems feature multiple homogeneous or heterogeneous computing units with deep memory hierarchies, and expect a high degree of thread-level parallelism from the software. Exploitation of data locality is critical to achieving scalable parallelism, but adds a significant dimension of complexity to performance optimization of parallel programs. This is especially true for programming models where locality is implicit and opaque to programmers. In this paper, we introduce the hierarchical place tree (HPT) model as a portable abstraction for task parallelism and data movement. The HPT model supports co-allocation of data and computation at multiple levels of a memory hierarchy. It can be viewed as a generalization of concepts from the Sequoia and X10 programming models, resulting in capabilities that are not supported by either. Compared to Sequoia, HPT supports three kinds of data …"
37,A comparative study of static and profile-based heuristics for inlining,136,2000,https://scholar.google.com/citations?view_op=view_citation&hl=en&user=XjeIqxYAAAAJ&pagesize=50&citation_for_view=XjeIqxYAAAAJ:Se3iqnhoufwC,"In this paper, we present a comparative study of static and profile-based heuristics for inlining. Our motivation for this study is to use the results to design the best inlining algorithm that we can for the Jalapeño dynamic optimizing compiler for Java [6]. We use a well-known approximation algorithm for the KNAPSACK problem as a common “meta-algorithm” for the inlining heuristics studied in this paper. We present performance results for an implementation of these inlining heuristics in the Jalapeño dynamic optimizing compiler. Our performance results show that the inlining heuristics studied in this paper can lead to significant speedups in execution time (up to 1.68x) even with modest limits on code size expansion (at most 10%)."
38,Savina-an actor benchmark suite: Enabling empirical evaluation of actor libraries,130,2014,https://scholar.google.com/citations?view_op=view_citation&hl=en&user=XjeIqxYAAAAJ&pagesize=50&citation_for_view=XjeIqxYAAAAJ:KbBQZpvPDL4C,"This paper introduces the Savina benchmark suite for actor-oriented programs. Our goal is to provide a standard benchmark suite that enables researchers and application developers to compare different actor implementations and identify those that deliver the best performance for a given use-case. The benchmarks in Savina are diverse, realistic, and represent compute (rather than I/O) intensive applications. They range from popular micro-benchmarks to classical concurrency problems to applications that demonstrate various styles of parallelism. Implementations of the benchmarks on various actor libraries are made publicly available through an open source release. This will allow other developers and researchers to compare the performance of their actor libraries on these common set of benchmarks."
39,Location consistency-a new memory model and cache consistency protocol,130,2000,https://scholar.google.com/citations?view_op=view_citation&hl=en&user=XjeIqxYAAAAJ&pagesize=50&citation_for_view=XjeIqxYAAAAJ:roLk4NBRz8UC,"Existing memory models and cache consistency protocols assume the memory coherence property which requires that all processors observe the same ordering of write operations to the same location. In this paper, we address the problem of defining a memory model that does not rely on the memory coherence assumption and also the problem of designing a cache consistency protocol based on such a memory model. We define a new memory consistency model, called Location Consistency (LC), in which the state of a memory location is modeled as a partially ordered multiset (pomset) of write and synchronization operations. We prove that LC is strictly weaker than existing memory models, but is still equivalent to stronger models for the common case of parallel programs that have no data races. We also describe a new multiprocessor cache consistency protocol based on the LC memory model. We prove that …"
40,Automatic selection of high-order transformations in the IBM XL FORTRAN compilers,125,1997,https://scholar.google.com/citations?view_op=view_citation&hl=en&user=XjeIqxYAAAAJ&pagesize=50&citation_for_view=XjeIqxYAAAAJ:hqOjcs7Dif8C,"The IBM ASTI optimizer provides the foundation for high-order transformations and automatic shared-memory parallelization in the latest IBM XL FORTRAN (XLF) compilers for RS/6000™ and PowerPC® uniprocessors and symmetric multiprocessors (SMPs), and for automatic distributed-memory parallelizationin the IBM XL High-Performance FORTRAN (XLHPF) compiler for the SP2™ distributed-memory multiprocessor. In this paper, we describe how the transformer component of the ASTI optimizer automatically selects high-order transformations for a given input program and a target uniprocessor, so as to improve utilization of the memory hierarchy (including cache and registers) and instruction-level parallelism. Our solution is centered on a quantitative approach in which optimization problems are formulated using quantitative cost models. The loop and data transformations currently employed by the ASTI …"
41,Efficient data race detection for async-finish parallelism,123,2012,https://scholar.google.com/citations?view_op=view_citation&hl=en&user=XjeIqxYAAAAJ&pagesize=50&citation_for_view=XjeIqxYAAAAJ:M05iB0D1s5AC,"A major productivity hurdle for parallel programming is the presence of data races. Data races can lead to all kinds of harmful program behaviors, including determinism violations and corrupted memory. However, runtime overheads of current dynamic data race detectors are still prohibitively large (often incurring slowdowns of 10× or more) for use in mainstream software development.In this paper, we present an efficient dynamic race detection algorithm that handles both the async-finish task-parallel programming model used in languages such as X10 and Habanero Java (HJ) and the spawn-sync constructs used in Cilk.We have implemented our algorithm in a tool called TaskChecker and evaluated it on a suite of 12 benchmarks. To reduce overhead of the dynamic analysis, we have also implemented various static optimizations in the tool. Our experimental results indicate that our approach performs well in …"
42,The RAW compiler project,122,1997,https://scholar.google.com/citations?view_op=view_citation&hl=en&user=XjeIqxYAAAAJ&pagesize=50&citation_for_view=XjeIqxYAAAAJ:0EnyYjriUFMC,"Compilers today are capable of inferring detailed information about program parallelism and analyzing whole-program behavior. However, the traditional interface between the compiler and the processor, as defined by the instruction set architecture (ISA), is unable to communicate much of the compiler knowledge to the processor. The approach taken by modern processors such as superscalars is to incorporate purely run-time algorithms in their hardware to perform analyses and optimizations such as detection of instruction-level parallelism. However, these complex hardware implementations can only exploit a small fraction of the parallelism information available to the compiler.The Raw architecture developed at MIT aims to maximally utilize the compiler by fully exposing the hardware and by delegating the hardware’s control completely to the software system. The Raw microprocessor, a set of simple RISC-like processor tiles interconnected with a high-speed 2D mesh network, does not provide hardware implementations for any of the complex algorithms found in conventional microprocessors. Instead, the compiler and the run-time software system fully orchestrate the Raw hardware resources, and they implement run-time analyses and optimizations tailored to the need of each individual application. This novel approach provides many opportunities and challenges for the Raw compiler and run-time system."
43,May-happen-in-parallel analysis of X10 programs,121,2007,https://scholar.google.com/citations?view_op=view_citation&hl=en&user=XjeIqxYAAAAJ&pagesize=50&citation_for_view=XjeIqxYAAAAJ:hFOr9nPyWt4C,"X10 is a modern object-oriented programming language designed for high performance, high productivity programming of parallel and multi-core computer systems. Compared to the lower-level thread-based concurrency model in the JavaTM language, X10 has higher-level concurrency constructs such as async, atomic and finish built into the language to simplify creation, analysis and optimization of parallel programs. In this paper, we introduce a new algorithm for May-Happen-in-Parallel (MHP) analysis of X10 programs. The analysis algorithm is based on simple path traversals in the Program Structure Tree, and does not rely on pointer alias analysis of thread objects as in MHP analysis for Java programs. We introduce a more precise definition of the MHP relation than in past work by adding condition vectors that identify execution instances for which the MHP relation holds, instead of just returning a single true …"
44,Integrating asynchronous task parallelism with MPI,120,2013,https://scholar.google.com/citations?view_op=view_citation&hl=en&user=XjeIqxYAAAAJ&pagesize=50&citation_for_view=XjeIqxYAAAAJ:xtoqd-5pKcoC,"Effective combination of inter-node and intra-node parallelism is recognized to be a major challenge for future extreme-scale systems. Many researchers have demonstrated the potential benefits of combining both levels of parallelism, including increased communication-computation overlap, improved memory utilization, and effective use of accelerators. However, current “hybrid programming” approaches often require significant rewrites of application code and assume a high level of programmer expertise. Dynamic task parallelism has been widely regarded as a programming model that combines the best of performance and programmability for shared-memory programs. For distributed-memory programs, most users rely on efficient implementations of MPI. In this paper, we propose HCMPI (Habanero-C MPI), an integration of the Habanero-C dynamic task-parallel programming model with the widely used MPI …"
45,Automatic detection of inter-application permission leaks in android applications,115,2013,https://scholar.google.com/citations?view_op=view_citation&hl=en&user=XjeIqxYAAAAJ&pagesize=50&citation_for_view=XjeIqxYAAAAJ:tuHXwOkdijsC,"The Android® operating system builds upon already well-established permission systems but complements them by allowing application components to be reused within and across applications through a single communication mechanism, called the Intent mechanism. In this paper, we describe techniques that we developed for statically detecting Android application vulnerability to attacks that obtain unauthorized access to permission-protected information. We address three kinds of such attacks, known as confused deputy, permission collusion, and Intent spoofing. We show that application vulnerability to these attacks can be detected using taint analysis. Based on this technique, we developed PermissionFlow, a tool for discovering vulnerabilities in the byte code and configuration of Android applications. To enable PermissionFlow analysis, we developed a static technique for automatic identification of …"
46,"Method of, system for, and computer program product for performing weighted loop fusion by an optimizing compiler",115,2000,https://scholar.google.com/citations?view_op=view_citation&hl=en&user=XjeIqxYAAAAJ&pagesize=50&citation_for_view=XjeIqxYAAAAJ:j3f4tGmQtD8C,"[54] METHOD OF, SYSTEM FOR, AND COMPUTER PROGRAM PRODUCT FOR PERFORMING WEIGHTED LOOP FUSION BY AN OPTIMIZING COMPILER"
47,Method and apparatus for efficient and precise datarace detection for multithreaded object-oriented programs,113,2009,https://scholar.google.com/citations?view_op=view_citation&hl=en&user=XjeIqxYAAAAJ&pagesize=50&citation_for_view=XjeIqxYAAAAJ:yD5IFk8b50cC,"The present invention generally relates to datarace detec tion for multithreaded object-oriented programs. More par ticularly, this invention provides a unique combination of static datarace analysis, optimized instrumentation, runtime access caching and runtime detection phases. 2. Description of the Related Art A datarace occurs in a multithreaded program when two threads access the same memory location with no ordering constraints enforced between the accesses, such that at least one of the accesses is a write. In most cases, a datarace is a programming error. Furthermore, programs containing data races are notoriously difficult to debug because they can exhibit different functional behaviors even when executed repeatedly with the same set of inputs and the same execution order of synchronization operations. Because of the detri mental effects of dataraces on the reliability and comprehen sibility of …"
48,X10: concurrent programming for modern architectures,111,2007,https://scholar.google.com/citations?view_op=view_citation&hl=en&user=XjeIqxYAAAAJ&pagesize=50&citation_for_view=XjeIqxYAAAAJ:L8Ckcad2t8MC,"Two major trends are converging to reshape the landscape of concurrent object-oriented programming languages. First, trends in modern architectures (multi-core, accelerators, high performance clusters such as Blue Gene) are making concurrency and distribution inescapable for large classes of OO programmers. Second, experience with first-generation concurrent OO languages (e.g. Java threads and synchronization) have revealed several drawbacks of unstructured threads with lock-based synchronization. X10 is a second generation OO language designed to address both programmer productivity and parallel performance for modern architectures. It extends sequential Java with a handful of constructs for concurrency and distribution. It introduces a clustered address space to deal with distribution. A computation is thought of as running at multiple places, with many simultaneous activities operating in each …"
49,S-cave: Effective ssd caching to improve virtual machine storage performance,110,2013,https://scholar.google.com/citations?view_op=view_citation&hl=en&user=XjeIqxYAAAAJ&pagesize=50&citation_for_view=XjeIqxYAAAAJ:CaZNVDsoPx4C,"A unique challenge for SSD storage caching management in a virtual machine (VM) environment is to accomplish the dual objectives: maximizing utilization of shared SSD cache devices and ensuring performance isolation among VMs. In this paper, we present our design and implementation of S-CAVE, a hypervisor-based SSD caching facility, which effectively manages a storage cache in a Multi-VM environment by collecting and exploiting runtime information from both VMs and storage devices. Due to a hypervisor's unique position between VMs and hardware resources, S-CAVE does not require any modification to guest OSes, user applications, or the underlying storage system. A critical issue to address in S-CAVE is how to allocate limited and shared SSD cache space among multiple VMs to achieve the dual goals. This is accomplished in two steps. First, we propose an effective metric to determine the …"
50,Habanero-Java library: a Java 8 framework for multicore programming,99,2014,https://scholar.google.com/citations?view_op=view_citation&hl=en&user=XjeIqxYAAAAJ&pagesize=50&citation_for_view=XjeIqxYAAAAJ:4vMrXwiscB8C,"With the advent of the multicore era, it is clear that future growth in application performance will primarily come from increased parallelism. We believe parallelism should be introduced early into the Computer Science curriculum to educate students on the fundamentals of parallel computation. In this paper, we introduce the newly-created Habanero-Java library (HJlib), a pure Java 8 library implementation of the pedagogic parallel programming model [12]. HJlib has been used in teaching a sophomore-level course titled ""Fundamentals of Parallel Programming"" at Rice University. HJlib adds to the Java ecosystem a powerful and portable task parallel programming model that can be used to parallelize both regular and irregular applications. By relying on simple orthogonal parallel constructs with important safety properties, HJlib allows programmers with a basic knowledge of Java to get started with parallel …"
